reports/p1c_eda/sizes.csv

file,train rows,test rows,test/train,train MB,test MB
source1,2206821,1732544.0,0.785,200.3,166.9
source2,5034616,4887273.0,0.971,466.6,485.9
source3,5285603,5082316.0,0.962,480.4,482.6
ground_truth,2206821,,,121.1,

reports/p0_load.md

### train_source1

- shape: **(2,206,821, 4)**   size: 200.3 MB
- columns: `['entity_id', 'business_name', 'business_address', 'country']`

### train_source2

- shape: **(5,034,616, 4)**   size: 466.6 MB
- columns: `['entity_id', 'business_name', 'business_address', 'country']`

### train_source3

- shape: **(5,285,603, 4)**   size: 480.4 MB
- columns: `['entity_id', 'business_name', 'business_address', 'country']`

### train_ground_truth

- shape: **(2,206,821, 2)**   size: 121.1 MB
- columns: `['source1_entity_id', 'matched_entity_ids']`

### test_source1

- shape: **(1,732,544, 4)**   size: 166.9 MB
- columns: `['entity_id', 'business_name', 'business_address', 'country']`

### test_source2

- shape: **(4,887,273, 4)**   size: 485.9 MB
- columns: `['entity_id', 'business_name', 'business_address', 'country']`

### test_source3

- shape: **(5,082,316, 4)**   size: 482.6 MB
- columns: `['entity_id', 'business_name', 'business_address', 'country']`